{"authority_anchors":{"%E5%8E%9F%E7%90%86/v2.1-production-spec/v2-production-system-contracts.md#3.4":"sha256:c34af7451919ad9a895644b40136062834b7ba9e857139f10b61f7dc51be67e9","%E5%8E%9F%E7%90%86/v2.1-production-spec/v2-production-system-contracts.md#4.1":"sha256:c34af7451919ad9a895644b40136062834b7ba9e857139f10b61f7dc51be67e9"},"contract_version":"2.1.3","format":"autocut.registry-source.handoff/v1","handoff_version":"1.0.0","producer":{"pack_id":"stage_05_owner_contribution","producer_git_commit":"31e3c1a461395a7f77cb9ed13e8dcd8111f8dac1","source_revision":"sha256:5a00aa90bf3ae0a297a6d4cafb7442aaade72d47f3605cea66bf3743e7a80465"},"review":{"producer_git_commit":"31e3c1a461395a7f77cb9ed13e8dcd8111f8dac1","review_record_hash":"sha256:1b5fa7e674422e8e629d2e256b8524f98920857b2f3224c346ebc0c760aab516","reviewer_id":"stage_05_owner_contribution_reviewer"},"source_paths":{"contributions/stage-05-owner-contribution.manifest.json":"sha256:36c54e207a19c8ebf554493b9a61386de7f3c2ae135a32c8f41e4e1c5b0b6e4e","contributions/stage-05-owner-contribution.manifest.schema.json":"sha256:c379e74ea1c33fa4ccd5d0e0a7494d64f5628f066318df56a651c76b5833d3ed","fixtures/stage-05-structural-valid.json":"sha256:ca0372d6067c3db8691b841ff71603a190fdaa58cc641a663ddf3f15b8b67eb1","obligations/stage-05-source-anchor-worklist.json":"sha256:1e45f6dfab4c0d417e983d8aeeda644652ca7e4520aa9bde0801a3cc4bb5ece3","obligations/stage-05-vector-anchor-worklist.json":"sha256:ac367f0463f8a00dc4e02b1d1bd4f09724e87b933b9f20ed5140a96c377ce7ed","shapes/publication-evidence-wire.local-shape.json":"sha256:7a0b004c2fd16bd54d9ddaf1dbcb43062496457e52b5abc664c9f6344ecf00e3","shapes/publication-target-surface-wire.local-shape.json":"sha256:e0a384a73d2808d79455afb292d5166c1a30bb54a050af47aef3ac1f554ac4aa","shapes/qc-metric-profile.local-shape.json":"sha256:71ba3715dd82157b981451757b735b4919f6dfea89c506179b36ad679ea9c99a","shapes/qc-observation-wire.local-shape.json":"sha256:15a6ec3b326935cab7760d2960c7f7e496afa5411503d8393b5f864509046d1a","shapes/release-lineage-wire.local-shape.json":"sha256:4d1672de5c91bf9470bcc5224bb9a427c9a083187188d6f01117dcef06c94b48","shapes/render-attempt-observation.local-shape.json":"sha256:de1dbb1b216223ff62f037587ca229bd9e085dddd33f06c8c5b9785edbb49758","shapes/render-input-wire.local-shape.json":"sha256:7a7b1ecdf3a4382f7189cfb0dc8a6fcf5b4dcaf558d511a301898fa86b036c90","shapes/rendered-asset-wire.local-shape.json":"sha256:20183a10f1b01d30b4df3315d3be1092c482a4e3e92cc9ef602dd28c2b35336d","tests/test-stage-05-owner-source.json":"sha256:dab847e00001a294f812a2781fb87c4b72886a6979cd24e2ce0d051af69826a3"},"source_tree_hash":"sha256:5a00aa90bf3ae0a297a6d4cafb7442aaade72d47f3605cea66bf3743e7a80465"}