{"authority_anchors":{"%E5%8E%9F%E7%90%86/v2.1-implementation-design/00-contract-toolchain-and-command-kernel.md#3.1":"sha256:14070fd600bcbeec72208e2035a330413d7febea5769f09c1e77ebfc50405920"},"contract_version":"2.1.3","format":"autocut.registry-source.handoff/v1","handoff_version":"1.0.0","producer":{"pack_id":"source_foundation","producer_git_commit":"1fd66f6598b950b19349a44113569c04e840a84f","source_revision":"sha256:2a7d08df95191f6c133594400593f63a157a4e6defc202a8bc858d84417c161e"},"review":{"producer_git_commit":"1fd66f6598b950b19349a44113569c04e840a84f","review_record_hash":"sha256:dcad2a68e9bb86fde2a64ce59eaed1218e2cf4bb46bbb15ece3c47c02471639a","reviewer_id":"source_foundation_reviewer"},"source_paths":{"handoff/handoff-manifest.schema.json":"sha256:ea216b0a61685e98191b1a67bce75fb1aaf126c68b7a5aafc6dd27737f8c0d39","schema-meta/owner-anchor.schema.json":"sha256:21cfd2eb5bc3ccda0cb28e2e92d046507b97758a823ef6e951e9aa5369443359","schema-meta/role-declarations.schema.json":"sha256:ecf95b2afb2da39a053fbedfa5c40e539dbeb6e97de872ef5a75c0dbe208fcab","schema-meta/state-machine.schema.json":"sha256:5240979aa6f7df60599ccc5cc362702bdb6be34ce57e35ea70be39ab8313ede9","schema-meta/transition.schema.json":"sha256:5f1dc3633ec06e93f7bfa81b5a232a8c79cc62e7e6b3f2eea7913e51af787b9f"},"source_tree_hash":"sha256:2a7d08df95191f6c133594400593f63a157a4e6defc202a8bc858d84417c161e"}
