{"authority_anchors":{"%E5%8E%9F%E7%90%86/v2.1-production-spec/v2-production-system-contracts.md#3.4":"sha256:c34af7451919ad9a895644b40136062834b7ba9e857139f10b61f7dc51be67e9","%E5%8E%9F%E7%90%86/v2.1-production-spec/v2-production-system-contracts.md#4.1":"sha256:c34af7451919ad9a895644b40136062834b7ba9e857139f10b61f7dc51be67e9"},"contract_version":"2.1.3","format":"autocut.registry-source.handoff/v1","handoff_version":"1.0.0","producer":{"pack_id":"stage_03_owner_contribution","producer_git_commit":"c647f4efabe83757918943092880d60c275dc984","source_revision":"sha256:6100f6f33cbe7419e26645c0cd48ff7811439c9081113771ca6cccd4f0dab46f"},"review":{"producer_git_commit":"c647f4efabe83757918943092880d60c275dc984","review_record_hash":"sha256:7a2882a02404efc6fd380e7d76659a242c2d7f70558257bd1b35addc78d375c3","reviewer_id":"stage_03_owner_contribution_reviewer"},"source_paths":{"contributions/stage-03-owner-contribution.manifest.json":"sha256:a5432a99a06f4f5781da94f712ddfcfa6b71fd4c3e348ac7a525bbf57e4e9c60","contributions/stage-03-owner-contribution.manifest.schema.json":"sha256:ec490700865138bb1bea56d44121aa3aeb38676053e77d5179b68fbfdb7c9a57","fixtures/structural/stage-03-owner-source-valid.json":"sha256:5924f618c586bd73c7f04d16e461b21f85ced0b2d3538f75f1cc4e65f7397f76","obligations/blueprint-projection-worklist.json":"sha256:3e8baea7b0be9138ff2c3c37cc78f90b24dae1c21599aeebca158ba97ff0020d","obligations/stage-03-rule-worklist.json":"sha256:14f738a5ce8d7848768ca794d5b53c4c4cb87fc24004f6a2a11af653ac97c787","obligations/stage-03-vector-worklist.json":"sha256:47ebdd3cff626b3611db36c49ea14156b21b0ebfeafade2b8a81f8be6dca4bed","shapes/context-manifest.shape.json":"sha256:5ceda510166d38709b4bbb6cabf8f414eb3f2cb9067d0ce4f7dd1735e8d1f33e","shapes/editorial-blueprint.shape.json":"sha256:6d4f77db406677681e7c9cdc54790d5c3483a2ae3532a35f6bc1acd35d4f49a5","shapes/evidence-closure-set.shape.json":"sha256:bf582e5ea7d164c93bc880b600ddfdc8259e1f9059e356bdb46d100a4eccc854","shapes/generation-partition-plan.shape.json":"sha256:666226ffc8f1e93a338365852f17de15956e708eb26e54fc083b4674f57651aa","shapes/merge-policy.shape.json":"sha256:640ac77ff52cf56699cc8b342d460135460e0d06f6a6ebe6027ed225da64ab1d","tests/test-stage-03-structural-source.json":"sha256:e5e676d4182eba6364b595d8f8c60b4896e1ace6dd6c70dbfb4d9cf5a3284be9"},"source_tree_hash":"sha256:6100f6f33cbe7419e26645c0cd48ff7811439c9081113771ca6cccd4f0dab46f"}