{"authority_anchors":{"%E5%8E%9F%E7%90%86/v2.1-production-spec/v2-production-system-contracts.md#3.4":"sha256:c34af7451919ad9a895644b40136062834b7ba9e857139f10b61f7dc51be67e9","%E5%8E%9F%E7%90%86/v2.1-production-spec/v2-production-system-contracts.md#4.1":"sha256:c34af7451919ad9a895644b40136062834b7ba9e857139f10b61f7dc51be67e9"},"contract_version":"2.1.3","format":"autocut.registry-source.handoff/v1","handoff_version":"1.0.0","producer":{"pack_id":"stage_01_owner_contribution","producer_git_commit":"a915bc8b3ce847c6a521efa8f0631408c294f022","source_revision":"sha256:ef343df9a281d0cc507646a205aec643511d294a6c800b6ab73afd819287917c"},"review":{"producer_git_commit":"a915bc8b3ce847c6a521efa8f0631408c294f022","review_record_hash":"sha256:f255919f1c856376dcff38e767b7955620cc6bba371caaf8402339b8155960f2","reviewer_id":"stage_01_owner_contribution_reviewer"},"source_paths":{"contracts/stage-01-rule-obligations.json":"sha256:38888ed92b281b98ba552f0e214200d0fc3133ea6bcf24f374041572bfb4a824","contracts/stage-01-vector-obligations.json":"sha256:0761f99e64b721e7118acd75791967d6c7db2401f555f0c9b5b6466af7ad9832","contributions/stage-01-owner-contribution.manifest.json":"sha256:199a69578932dabeaae43afd7ce29378ac85d7a2e4cf0674bdd80ed27b1fa826","contributions/stage-01-owner-contribution.manifest.schema.json":"sha256:eb9030d96e376983db4580547d383ca6e21e8f60ebd2978d07a743d83ccfe3b8","fixtures/stage-01-owner-source-valid.json":"sha256:335954bd92749e8eaff3206f18f66eb2186d95c6e8743d67d5dec913877b4a81","schemas/coverage-ledger.schema.json":"sha256:1ff9bbccf367e627bd3c3cab7b6055ea3e8e466cdb96e75d67c54cc6db1561ef","schemas/dependency-closure-proof.schema.json":"sha256:cc3f1b9cf30593d55b7ac33ce30c0def85bf275e0b7e134d20d3a9ad21805ab6","schemas/dependency-propagation-policy.schema.json":"sha256:36f9583fcb6f467c2b383b450eb8f9cb99748dd5828336669f34fdbfa9991c78","schemas/episode-digest-set.schema.json":"sha256:98c5713753d5e46bbadd0a27c3dfeadb14cb94dd457dde4d6f0554e51e62dbcc","schemas/event-card-set.schema.json":"sha256:bd22bcb5f1ca0bff6ebab4f0b56c02d3916a447523e646f8ab67460feab8c23c","schemas/narrative-graph.schema.json":"sha256:0e82c47391a430d5c3550b91d42b5f0153da240d1bf9d44363d68f5139f1083f","schemas/source-knowledge-input-set.schema.json":"sha256:b5a36512ca7fa33b333863a4f35a4ffb0b7b839dd9cdfeb41b6b1a518e913a02","tests/test-stage-01-owner-source.json":"sha256:ca89bbf2a4f463f8dc6a3a0d36579a94e73161be3cf75784552260350ac7fc90"},"source_tree_hash":"sha256:ef343df9a281d0cc507646a205aec643511d294a6c800b6ab73afd819287917c"}