{"authority_anchors":{"%E5%8E%9F%E7%90%86/v2.1-production-spec/v2-production-system-contracts.md#3.4":"sha256:c34af7451919ad9a895644b40136062834b7ba9e857139f10b61f7dc51be67e9","%E5%8E%9F%E7%90%86/v2.1-production-spec/v2-production-system-contracts.md#4.1":"sha256:c34af7451919ad9a895644b40136062834b7ba9e857139f10b61f7dc51be67e9"},"contract_version":"2.1.3","format":"autocut.registry-source.handoff/v1","handoff_version":"1.0.0","producer":{"pack_id":"common_system_direct_contribution","producer_git_commit":"eb7e4181f63da308c405bad6d99fcd085cfdd98a","source_revision":"sha256:d62789482ede283ad373856cf54c30f1a43315ffaaf036cc15eec7b4ee3e6bb4"},"review":{"producer_git_commit":"eb7e4181f63da308c405bad6d99fcd085cfdd98a","review_record_hash":"sha256:f5fa840684987a30420336d61b4649243b1784b6788a96bf35983c2f0166e689","reviewer_id":"common_system_direct_reviewer"},"source_paths":{"contributions/common-system-direct-contribution-manifest.schema.json":"sha256:4df37513b1bc03d530bc36482127947e3c3b598d559a97f6cbceeb29b2fead92","contributions/common-system-direct-contribution.manifest.json":"sha256:556e05d5e5e1c7eb8aad4e230e7af26420f2f401001029c692e957026d6a08e3"},"source_tree_hash":"sha256:d62789482ede283ad373856cf54c30f1a43315ffaaf036cc15eec7b4ee3e6bb4"}
