{"authority_anchors":{"%E5%8E%9F%E7%90%86/v2.1-production-spec/v2-production-system-contracts.md#3.4":"sha256:c34af7451919ad9a895644b40136062834b7ba9e857139f10b61f7dc51be67e9","%E5%8E%9F%E7%90%86/v2.1-production-spec/v2-production-system-contracts.md#4.1":"sha256:c34af7451919ad9a895644b40136062834b7ba9e857139f10b61f7dc51be67e9"},"contract_version":"2.1.3","format":"autocut.registry-source.handoff/v1","handoff_version":"1.0.0","producer":{"pack_id":"stage_04_owner_contribution","producer_git_commit":"2d882e8cbdfbe8a3bd5462ee82f683abc9fd34b2","source_revision":"sha256:99ad00c28f5abb86853bff47a151ee375fa0bfbb9493cf78227dbe782909fc1e"},"review":{"producer_git_commit":"2d882e8cbdfbe8a3bd5462ee82f683abc9fd34b2","review_record_hash":"sha256:e4299b1c2075533e262097bb641dc4067f703d51171eaed12e2aee7d0ae0039c","reviewer_id":"stage_04_owner_contribution_reviewer"},"source_paths":{"contributions/stage-04-owner-contribution.manifest.json":"sha256:2d7f2cf174f8fa462441eccf3fa69452f1018e3fc627e3750aee16a85f8b6175","contributions/stage-04-owner-contribution.manifest.schema.json":"sha256:f5bd06fd0715d626df729a0f309f6fe9ec5cf67d1e5020a960802a9ee762e8f1","fixtures/stage-04-structural-valid.json":"sha256:40f84366b358ccde322e5d3aa1b7c2abf13ecbcdb3b3924ac7efd6008c714624","obligations/stage-04-source-anchor-worklist.json":"sha256:77c4d31b70811bbd4e79a53765e7ecf3092696664f7689681afd469057d657e7","obligations/stage-04-vector-anchor-worklist.json":"sha256:7127ecf0c343a97e091c54a34d78d26c4efdf2d4202b7798653cfc2464d4a825","shapes/boundary-selection-policy.local-shape.json":"sha256:277d63facf6c38c7ed6fc8e110aaf1f0f9ae3f66989ca48b8323c381e0d283f5","shapes/certificate-reference.local-shape.json":"sha256:5ad2e134f4f3cab2e004f6d97ee5f41e22db22c14cf589aab58cd5b723bfc20e","shapes/compilation-report.local-shape.json":"sha256:676ccb49fd71a1c04cc9cad12f3244e53755fee18147e794bf3749205088ac68","shapes/media-evidence-wire.local-shape.json":"sha256:c12c0299441bcec8db669fd543cf2c4f8835effb582890fff7b62f3628ef368b","shapes/recipe-and-junction.local-shape.json":"sha256:09efc711e7c1b9eefd04f7fe2fa6e96d998f4919230371d1f5dbc48cc412ba12","shapes/span-variant.local-shape.json":"sha256:4ab227e3b96389955a2a6edf2ad350303254e3d5d98f6a1e68fe098b533d9bed","shapes/time-and-media.local-shape.json":"sha256:f7b4778cba8a559ad8c47a40bfe0db543fd264d6957fa441d8e194a332793360","tests/test-stage-04-owner-source.json":"sha256:585e66d44d8ca12c63c9b673f2ae95d9b802d62fa379349e66f2b98da27248fe"},"source_tree_hash":"sha256:99ad00c28f5abb86853bff47a151ee375fa0bfbb9493cf78227dbe782909fc1e"}